{
  "acceptance_criteria": [
    {
      "critical": true,
      "evidence_refs": [],
      "id": "AC-01",
      "text": "The requested behavior is demonstrably complete."
    }
  ],
  "assumptions": [
    {
      "evidence_refs": [],
      "id": "AS-01",
      "status": "unverified",
      "text": "The existing command surface remains compatible."
    }
  ],
  "brief_id": "WB-0001",
  "constraints": [
    {
      "id": "C-01",
      "source_evidence_refs": [],
      "strength": "invariant",
      "text": "Do not bypass human approval gates."
    }
  ],
  "contract_version": "work-brief/v1",
  "created_at": "2026-07-11T00:00:00Z",
  "created_by": "operator",
  "intent": {
    "desired_outcome": "A reviewable execution input exists.",
    "problem": "The task intent is not captured as a versioned artifact.",
    "target_user": "project operator"
  },
  "non_goals": [
    "Do not select or invoke a model."
  ],
  "revision": 1,
  "target": {
    "id": "T-0001",
    "type": "task"
  }
}
