{
  "acceptance_criteria": [
    {
      "critical": true,
      "evidence_refs": [],
      "id": "AC-01",
      "text": "The deterministic Adaptive Entry contracts and tests pass."
    }
  ],
  "assumptions": [],
  "brief_id": "WB-0042",
  "constraints": [
    {
      "id": "C-01",
      "source_evidence_refs": [],
      "strength": "invariant",
      "text": "DB schema remains 8."
    },
    {
      "id": "C-02",
      "source_evidence_refs": [],
      "strength": "invariant",
      "text": "No dependency is added."
    }
  ],
  "contract_version": "work-brief/v1",
  "created_at": "2026-07-11T00:00:00Z",
  "created_by": "codex:delegated-by-user",
  "intent": {
    "desired_outcome": "Adaptive Entry is locally verified and remains human-gated for release.",
    "problem": "The v0.4.2 entry policy needs deterministic, auditable behavior."
  },
  "non_goals": [
    "Do not publish a release."
  ],
  "revision": 1,
  "target": {
    "id": "T-0035",
    "type": "task"
  }
}
