{
  "acceptance_criteria": [
    {
      "critical": true,
      "evidence_refs": [],
      "id": "AC-01",
      "text": "The starter repository can initialize and produce a deterministic route."
    }
  ],
  "assumptions": [],
  "brief_id": "WB-0043",
  "constraints": [
    {
      "id": "C-01",
      "source_evidence_refs": [],
      "strength": "local",
      "text": "Use only a temporary archive of the external repository HEAD."
    }
  ],
  "contract_version": "work-brief/v1",
  "created_at": "2026-07-11T00:00:00Z",
  "created_by": "codex:delegated-by-user",
  "intent": {
    "desired_outcome": "The external starter case exercises clear, ambiguous, and high-risk routing.",
    "problem": "Adaptive Entry needs evidence outside the harness repository."
  },
  "non_goals": [
    "Do not modify the source checkout."
  ],
  "revision": 1,
  "target": {
    "id": "T-0001",
    "type": "task"
  }
}
